{
  "status": "not_a_leaf",
  "crop": null,
  "disease": null,
  "pathogen": null,
  "confidence": 0.99,
  "severity": null,
  "source": "cloud",
  "symptoms": [],
  "treatment": null,
  "disclaimer": "Guidance only — confirm with a local agricultural extension officer before applying any chemical treatment."
}
